name,value,description,label,software
hadoop.http.authentication.signature.secret.file,${user.home}/hadoop-http-auth-signature-secret,The signature secret for signing the authentication tokens. The same secret should be used for JT/NN/DN/TT configurations.,security,core
hadoop.http.cross-origin.allowed-headers,"X-Requested-With,Content-Type,Accept,Origin",Comma separated list of headers that are allowed for web services needing cross-origin (CORS) support.,others,core
hadoop.http.cross-origin.max-age,1800,The number of seconds a pre-flighted request can be cached for web services needing cross-origin (CORS) support.,reliability,core
dfs.ha.fencing.ssh.connect-timeout,30000,"SSH connection timeout, in milliseconds, to use with the builtin sshfence fencer.",reliability,core
ha.zookeeper.session-timeout.ms,10000,"The session timeout to use when the ZKFC connects to ZooKeeper. Setting this value to a lower value implies that server crashes will be detected more quickly, but risks triggering failover too aggressively in the case of a transient error or network blip.",reliability,core
ha.zookeeper.auth,,"A comma-separated list of ZooKeeper authentications to add when connecting to ZooKeeper. These are specified in the same format as used by the ""addauth"" command in the ZK CLI. It is important that the authentications specified here are sufficient to access znodes with the ACL specified in ha.zookeeper.acl. If the auths contain secrets, you may instead specify a path to a file, prefixed with the '@' symbol, and the value of this configuration will be loaded from within.",security,core
ha.health-monitor.connect-retry-interval.ms,1000,How often to retry connecting to the service.,reliability,core
ha.health-monitor.check-interval.ms,1000,How often to check the service.,reliability,core
ha.health-monitor.sleep-after-disconnect.ms,1000,How long to sleep after an unexpected RPC error.,reliability,core
ha.health-monitor.rpc-timeout.ms,45000,Timeout for the actual monitorHealth() calls.,reliability,core
ha.failover-controller.new-active.rpc-timeout.ms,60000,Timeout that the FC waits for the new active to become active,reliability,core
ha.failover-controller.graceful-fence.rpc-timeout.ms,5000,Timeout that the FC waits for the old active to go to standby,reliability,core
ha.failover-controller.graceful-fence.connection.retries,1,FC connection retries for graceful fencing,reliability,core
ha.failover-controller.cli-check.rpc-timeout.ms,20000,"Timeout that the CLI (manual) FC waits for monitorHealth, getServiceState",reliability,core
ipc.client.fallback-to-simple-auth-allowed,FALSE,"When a client is configured to attempt a secure connection, but attempts to connect to an insecure server, that server may instruct the client to switch to SASL SIMPLE (unsecure) authentication. This setting controls whether or not the client will accept this instruction from the server. When false (the default), the client will not allow the fallback to SIMPLE authentication, and will abort the connection.",security,core
hadoop.security.crypto.codec.classes.aes.ctr.nopadding,"org.apache.hadoop.crypto.OpensslAesCtrCryptoCodec, org.apache.hadoop.crypto.JceAesCtrCryptoCodec","Comma-separated list of crypto codec implementations for AES/CTR/NoPadding. The first implementation will be used if available, others are fallbacks.",others,core
hadoop.security.crypto.buffer.size,8192,The buffer size used by CryptoInputStream and CryptoOutputStream.,performance,core
hadoop.security.kms.client.authentication.retry-count,1,Number of time to retry connecting to KMS on authentication failure,reliability,core
hadoop.security.kms.client.encrypted.key.cache.size,500,Size of the EncryptedKeyVersion cache Queue for each key,performance,core
hadoop.security.kms.client.encrypted.key.cache.num.refill.threads,2,Number of threads to use for refilling depleted EncryptedKeyVersion cache Queues,performance,core
hadoop.security.kms.client.encrypted.key.cache.expiry,43200000,"Cache expiry time for a Key, after which the cache Queue for this key will be dropped. Default = 12hrs",reliability,core
hadoop.security.kms.client.timeout,60,"Sets value for KMS client connection timeout, and the read timeout to KMS servers.",reliability,core
hadoop.security.kms.client.failover.sleep.base.millis,100,"Expert only. The time to wait, in milliseconds, between failover attempts increases exponentially as a function of the number of attempts made so far, with a random factor of +/- 50%. This option specifies the base value used in the failover calculation. The first failover will retry immediately. The 2nd failover attempt will delay at least hadoop.security.client.failover.sleep.base.millis milliseconds. And so on.",reliability,core
hadoop.security.kms.client.failover.sleep.max.millis,2000,"Expert only. The time to wait, in milliseconds, between failover attempts increases exponentially as a function of the number of attempts made so far, with a random factor of +/- 50%. This option specifies the maximum value to wait between failovers. Specifically, the time between two failover attempts will not exceed +/- 50% of hadoop.security.client.failover.sleep.max.millis milliseconds.",reliability,core
ipc.server.max.connections,0,"The maximum number of concurrent connections a server is allowed to accept. If this limit is exceeded, incoming connections will first fill the listen queue and then may go to an OS-specific listen overflow queue. The client may fail or timeout, but the server can avoid running out of file descriptors using this feature. 0 means no limit.",reliability,core
hadoop.registry.zk.session.timeout.ms,60000,Zookeeper session timeout in milliseconds,reliability,core
hadoop.registry.zk.connection.timeout.ms,15000,Zookeeper connection timeout in milliseconds,reliability,core
hadoop.registry.zk.retry.times,5,Zookeeper connection retry count before failing,reliability,core
hadoop.registry.zk.retry.ceiling.ms,60000,"Zookeeper retry limit in milliseconds, during exponential backoff. This places a limit even if the retry times and interval limit, combined with the backoff policy, result in a long retry period",reliability,core
hadoop.registry.zk.quorum,localhost:2181,List of hostname:port pairs defining the zookeeper quorum binding for the registry,environment,core
hadoop.registry.secure,FALSE,"Key to set if the registry is secure. Turning it on changes the permissions policy from ""open access"" to restrictions on kerberos with the option of a user adding one or more auth key pairs down their own tree.",security,core
fs.client.htrace.sampler.classes,,The class names of the HTrace Samplers to use for Hadoop filesystem clients.,others,core
hadoop.htrace.span.receiver.classes,,The class names of the Span Receivers to use for Hadoop.,others,core
fs.adl.oauth2.msi.port,,"The localhost port for the MSI token service. This is the port specified when creating the Azure VM. The default, if this setting is not specified, is 50342. Used by MSI token provider.",environment,core
fs.adl.oauth2.devicecode.clientapp.id,,The app id of the AAD native app in whose context the auth request should be made. Used by DeviceCode token provider.,others,core
hadoop.caller.context.max.size,128,"The maximum bytes a caller context string can have. If the passed caller context is longer than this maximum bytes, client will truncate it before sending to server. Note that the server may have a different maximum size, and will truncate the caller context to the maximum size it allows.",performance,core
seq.io.sort.mb,100,"The total amount of buffer memory to use while sorting files, while using SequenceFile.Sorter, in megabytes. By default, gives each merge stream 1MB, which should minimize seeks.",performance,core
hadoop.zk.address,,Host:Port of the ZooKeeper server to be used.,environment,core
hadoop.zk.num-retries,1000,Number of tries to connect to ZooKeeper.,reliability,core
hadoop.zk.retry-interval-ms,1000,Retry interval in milliseconds when connecting to ZooKeeper.,reliability,core
hadoop.zk.timeout-ms,10000,"ZooKeeper session timeout in milliseconds. Session expiration is managed by the ZooKeeper cluster itself, not by the client. This value is used by the cluster to determine when the client's session expires. Expirations happens when the cluster does not hear from the client within the specified session timeout period (i.e. no heartbeat).",reliability,core
hadoop.zk.auth,,"Specify the auths to be used for the ACL's specified in hadoop.zk.acl. This takes a comma-separated list of authentication mechanisms, each of the form 'scheme:auth' (the same syntax used for the 'addAuth' command in the ZK CLI).",security,core
