name,software,description,label,
hadoop.hdfs.configuration.version,hdfs,version of this configuration file,others,
dfs.namenode.rpc-address,hdfs,"RPC address that handles all clients requests. In the case of HA/Federation where multiple namenodes exist, the name service id is added to the name e.g. dfs.namenode.rpc-address.ns1 dfs.namenode.rpc-address.EXAMPLENAMESERVICE The value of this property will take the form of nn-host1:rpc-port.",environment,
dfs.namenode.rpc-bind-host,hdfs,"The actual address the RPC server will bind to. If this optional address is set, it overrides only the hostname portion of dfs.namenode.rpc-address. It can also be specified per name node or name service for HA/Federation. This is useful for making the name node listen on all interfaces by setting it to 0.0.0.0.",environment,
dfs.namenode.servicerpc-address,hdfs,"RPC address for HDFS Services communication. BackupNode, Datanodes and all other services should be connecting to this address if it is configured. In the case of HA/Federation where multiple namenodes exist, the name service id is added to the name e.g. dfs.namenode.servicerpc-address.ns1 dfs.namenode.rpc-address.EXAMPLENAMESERVICE The value of this property will take the form of nn-host1:rpc-port. If the value of this property is unset the value of dfs.namenode.rpc-address will be used as the default.",environment,
dfs.namenode.servicerpc-bind-host,hdfs,"The actual address the service RPC server will bind to. If this optional address is set, it overrides only the hostname portion of dfs.namenode.servicerpc-address. It can also be specified per name node or name service for HA/Federation. This is useful for making the name node listen on all interfaces by setting it to 0.0.0.0.",environment,
dfs.namenode.lifeline.rpc-address,hdfs,"NameNode RPC lifeline address. This is an optional separate RPC address that can be used to isolate health checks and liveness to protect against resource exhaustion in the main RPC handler pool. In the case of HA/Federation where multiple NameNodes exist, the name service ID is added to the name e.g. dfs.namenode.lifeline.rpc-address.ns1. The value of this property will take the form of nn-host1:rpc-port. If this property is not defined, then the NameNode will not start a lifeline RPC server. By default, the property is not defined.",environment,
dfs.namenode.lifeline.rpc-bind-host,hdfs,"The actual address the lifeline RPC server will bind to. If this optional address is set, it overrides only the hostname portion of dfs.namenode.lifeline.rpc-address. It can also be specified per name node or name service for HA/Federation. This is useful for making the name node listen on all interfaces by setting it to 0.0.0.0.",environment,
dfs.namenode.secondary.http-address,hdfs,The secondary namenode http server address and port.,environment,
dfs.namenode.secondary.https-address,hdfs,The secondary namenode HTTPS server address and port.,environment,
dfs.datanode.address,hdfs,The datanode server address and port for data transfer.,environment,
dfs.datanode.http.address,hdfs,The datanode http server address and port.,environment,
dfs.datanode.ipc.address,hdfs,The datanode ipc server address and port.,environment,
dfs.datanode.http.internal-proxy.port,hdfs,The datanode's internal web proxy port. By default it selects a random port available in runtime.,environment,
dfs.datanode.handler.count,hdfs,The number of server threads for the datanode.,performance,
dfs.namenode.http-address,hdfs,The address and the base port where the dfs namenode web ui will listen on.,environment,
dfs.namenode.http-bind-host,hdfs,"The actual adress the HTTP server will bind to. If this optional address is set, it overrides only the hostname portion of dfs.namenode.http-address. It can also be specified per name node or name service for HA/Federation. This is useful for making the name node HTTP server listen on all interfaces by setting it to 0.0.0.0.",environment,
dfs.namenode.heartbeat.recheck-interval,hdfs,"This time decides the interval to check for expired datanodes. With this value and dfs.heartbeat.interval, the interval of deciding the datanode is stale or not is also calculated. The unit of this configuration is millisecond.",reliability,
dfs.http.policy,hdfs,Decide if HTTPS(SSL) is supported on HDFS This configures the HTTP endpoint for HDFS daemons: The following values are supported: - HTTP_ONLY : Service is provided only on http - HTTPS_ONLY : Service is provided only on https - HTTP_AND_HTTPS : Service is provided both on http and https,security,
dfs.client.https.need-auth,hdfs,Whether SSL client certificate authentication is required,security,
dfs.client.cached.conn.retry,hdfs,"The number of times the HDFS client will pull a socket from the cache. Once this number is exceeded, the client will try to create a new socket.",reliability,
dfs.https.server.keystore.resource,hdfs,Resource file from which ssl server keystore information will be extracted,environment,
dfs.client.https.keystore.resource,hdfs,Resource file from which ssl client keystore information will be extracted,environment,
dfs.datanode.https.address,hdfs,The datanode secure http server address and port.,environment,
dfs.namenode.https-address,hdfs,The namenode secure http server address and port.,environment,
dfs.namenode.https-bind-host,hdfs,"The actual adress the HTTPS server will bind to. If this optional address is set, it overrides only the hostname portion of dfs.namenode.https-address. It can also be specified per name node or name service for HA/Federation. This is useful for making the name node HTTPS server listen on all interfaces by setting it to 0.0.0.0.",environment,
dfs.datanode.dns.interface,hdfs,The name of the Network Interface from which a data node should report its IP address. e.g. eth2. This setting may be required for some multi-homed nodes where the DataNodes are assigned multiple hostnames and it is desirable for the DataNodes to use a non-default hostname. Prefer using hadoop.security.dns.interface over dfs.datanode.dns.interface.,environment,
dfs.datanode.dns.nameserver,hdfs,The host name or IP address of the name server (DNS) which a DataNode should use to determine its own host name. Prefer using hadoop.security.dns.nameserver over dfs.datanode.dns.nameserver.,environment,
dfs.namenode.backup.address,hdfs,The backup node server address and port. If the port is 0 then the server will start on a free port.,environment,
dfs.namenode.backup.http-address,hdfs,The backup node http server address and port. If the port is 0 then the server will start on a free port.,environment,
dfs.namenode.replication.considerLoad,hdfs,Decide if chooseTarget considers the target's load or not,manageability,
dfs.namenode.replication.considerLoad.factor,hdfs,"The factor by which a node's load can exceed the average before being rejected for writes, only if considerLoad is true.",reliability,
dfs.default.chunk.view.size,hdfs,The number of bytes to view for a file on the browser.,manageability,
dfs.datanode.du.reserved.calculator,hdfs,"Determines the class of ReservedSpaceCalculator to be used for calculating disk space reservedfor non-HDFS data. The default calculator is ReservedSpaceCalculatorAbsolute which will use dfs.datanode.du.reserved for a static reserved number of bytes. ReservedSpaceCalculatorPercentage will use dfs.datanode.du.reserved.pct to calculate the reserved number of bytes based on the size of the storage. ReservedSpaceCalculatorConservative and ReservedSpaceCalculatorAggressive will use their combination, Conservative will use maximum, Aggressive minimum. For more details see ReservedSpaceCalculator.",performance,
dfs.datanode.du.reserved,hdfs,"Reserved space in bytes per volume. Always leave this much space free for non dfs use. Specific storage type based reservation is also supported. The property can be followed with corresponding storage types ([ssd]/[disk]/[archive]/[ram_disk]) for cluster with heterogeneous storage. For example, reserved space for RAM_DISK storage can be configured using property 'dfs.datanode.du.reserved.ram_disk'. If specific storage type reservation is not configured then dfs.datanode.du.reserved will be used.",performance,
dfs.datanode.du.reserved.pct,hdfs,"Reserved space in percentage. Read dfs.datanode.du.reserved.calculator to see when this takes effect. The actual number of bytes reserved will be calculated by using the total capacity of the data directory in question. Specific storage type based reservation is also supported. The property can be followed with corresponding storage types ([ssd]/[disk]/[archive]/[ram_disk]) for cluster with heterogeneous storage. For example, reserved percentage space for RAM_DISK storage can be configured using property 'dfs.datanode.du.reserved.pct.ram_disk'. If specific storage type reservation is not configured then dfs.datanode.du.reserved.pct will be used.",manageability,
dfs.namenode.name.dir,hdfs,"Determines where on the local filesystem the DFS name node should store the name table(fsimage). If this is a comma-delimited list of directories then the name table is replicated in all of the directories, for redundancy.",environment,
dfs.namenode.name.dir.restore,hdfs,"Set to true to enable NameNode to attempt recovering a previously failed dfs.namenode.name.dir. When enabled, a recovery of any failed directory is attempted during checkpoint.",reliability,
dfs.namenode.fs-limits.max-component-length,hdfs,Defines the maximum number of bytes in UTF-8 encoding in each component of a path. A value of 0 will disable the check.,manageability,
dfs.namenode.fs-limits.max-directory-items,hdfs,Defines the maximum number of items that a directory may contain. Cannot set the property to a value less than 1 or more than 6400000.,manageability,
dfs.namenode.fs-limits.min-block-size,hdfs,"Minimum block size in bytes, enforced by the Namenode at create time. This prevents the accidental creation of files with tiny block sizes (and thus many blocks), which can degrade performance.",performance,
dfs.namenode.fs-limits.max-blocks-per-file,hdfs,"Maximum number of blocks per file, enforced by the Namenode on write. This prevents the creation of extremely large files which can degrade performance.",performance,
dfs.namenode.edits.dir,hdfs,"Determines where on the local filesystem the DFS name node should store the transaction (edits) file. If this is a comma-delimited list of directories then the transaction file is replicated in all of the directories, for redundancy. Default value is same as dfs.namenode.name.dir",environment,
dfs.namenode.edits.dir.required,hdfs,"This should be a subset of dfs.namenode.edits.dir, to ensure that the transaction (edits) file in these places is always up-to-date.",environment,
dfs.namenode.shared.edits.dir,hdfs,A directory on shared storage between the multiple namenodes in an HA cluster. This directory will be written by the active and read by the standby in order to keep the namespaces synchronized. This directory does not need to be listed in dfs.namenode.edits.dir above. It should be left empty in a non-HA cluster.,environment,
dfs.permissions.enabled,hdfs,"If ""true"", enable permission checking in HDFS. If ""false"", permission checking is turned off, but all other behavior is unchanged. Switching from one parameter value to the other does not change the mode, owner or group of files or directories.",security,
dfs.permissions.superusergroup,hdfs,The name of the group of super-users. The value should be a single group name.,manageability,
dfs.cluster.administrators,hdfs,"ACL for the admins, this configuration is used to control who can access the default servlets in the namenode, etc. The value should be a comma separated list of users and groups. The user list comes first and is separated by a space followed by the group list, e.g. ""user1,user2 group1,group2"". Both users and groups are optional, so ""user1"", "" group1"", """", ""user1 group1"", ""user1,user2 group1,group2"" are all valid (note the leading space in "" group1""). '*' grants access to all users and groups, e.g. '*', '* ' and ' *' are all valid.",manageability,
dfs.namenode.acls.enabled,hdfs,"Set to true to enable support for HDFS ACLs (Access Control Lists). By default, ACLs are disabled. When ACLs are disabled, the NameNode rejects all RPCs related to setting or getting ACLs.",security,
dfs.namenode.lazypersist.file.scrub.interval.sec,hdfs,The NameNode periodically scans the namespace for LazyPersist files with missing blocks and unlinks them from the namespace. This configuration key controls the interval between successive scans. Set it to a negative value to disable this behavior.,reliability,
dfs.block.access.token.enable,hdfs,"If ""true"", access tokens are used as capabilities for accessing datanodes. If ""false"", no access tokens are checked on accessing datanodes.",security,
dfs.block.access.key.update.interval,hdfs,Interval in minutes at which namenode updates its access keys.,security,
dfs.block.access.token.lifetime,hdfs,The lifetime of access tokens in minutes.,security,
dfs.datanode.data.dir,hdfs,"Determines where on the local filesystem an DFS data node should store its blocks. If this is a comma-delimited list of directories, then data will be stored in all named directories, typically on different devices. The directories should be tagged with corresponding storage types ([SSD]/[DISK]/[ARCHIVE]/[RAM_DISK]) for HDFS storage policies. The default storage type will be DISK if the directory does not have a storage type tagged explicitly. Directories that do not exist will be created if local filesystem permission allows.",environment,
dfs.datanode.data.dir.perm,hdfs,Permissions for the directories on on the local filesystem where the DFS data node store its blocks. The permissions can either be octal or symbolic.,security,
dfs.replication,hdfs,Default block replication. The actual number of replications can be specified when the file is created. The default is used if replication is not specified in create time.,reliability,
dfs.replication.max,hdfs,Maximal block replication.,reliability,
dfs.namenode.replication.min,hdfs,Minimal block replication.,reliability,
dfs.namenode.maintenance.replication.min,hdfs,Minimal live block replication in existence of maintenance mode.,reliability,
dfs.namenode.safemode.replication.min,hdfs,a separate minimum replication factor for calculating safe block count. This is an expert level setting. Setting this lower than the dfs.namenode.replication.min is not recommend and/or dangerous for production setups. When it's not set it takes value from dfs.namenode.replication.min,reliability,
dfs.namenode.max-corrupt-file-blocks-returned,hdfs,"The maximum number of corrupt file blocks listed by NameNode Web UI, JMX and other client request.",reliability,
dfs.blocksize,hdfs,"The default block size for new files, in bytes. You can use the following suffix (case insensitive): k(kilo), m(mega), g(giga), t(tera), p(peta), e(exa) to specify the size (such as 128k, 512m, 1g, etc.), Or provide complete size in bytes (such as 134217728 for 128 MB).",manageability,
dfs.client.block.write.retries,hdfs,"The number of retries for writing blocks to the data nodes, before we signal failure to the application.",reliability,
dfs.client.block.write.replace-datanode-on-failure.enable,hdfs,"If there is a datanode/network failure in the write pipeline, DFSClient will try to remove the failed datanode from the pipeline and then continue writing with the remaining datanodes. As a result, the number of datanodes in the pipeline is decreased. The feature is to add new datanodes to the pipeline. This is a site-wide property to enable/disable the feature. When the cluster size is extremely small, e.g. 3 nodes or less, cluster administrators may want to set the policy to NEVER in the default configuration file or disable this feature. Otherwise, users may experience an unusually high rate of pipeline failures since it is impossible to find new datanodes for replacement. See also dfs.client.block.write.replace-datanode-on-failure.policy",reliability,
dfs.client.block.write.replace-datanode-on-failure.policy,hdfs,This property is used only if the value of dfs.client.block.write.replace-datanode-on-failure.enable is true. ALWAYS: always add a new datanode when an existing datanode is removed. NEVER: never add a new datanode. DEFAULT: Let r be the replication number. Let n be the number of existing datanodes. Add a new datanode only if r is greater than or equal to 3 and either (1) floor(r/2) is greater than or equal to n; or (2) r is greater than n and the block is hflushed/appended.,reliability,manageability
dfs.client.block.write.replace-datanode-on-failure.best-effort,hdfs,"This property is used only if the value of dfs.client.block.write.replace-datanode-on-failure.enable is true. Best effort means that the client will try to replace a failed datanode in write pipeline (provided that the policy is satisfied), however, it continues the write operation in case that the datanode replacement also fails. Suppose the datanode replacement fails. false: An exception should be thrown so that the write will fail. true : The write should be resumed with the remaining datandoes. Note that setting this property to true allows writing to a pipeline with a smaller number of datanodes. As a result, it increases the probability of data loss.",reliability,
dfs.client.block.write.replace-datanode-on-failure.min-replication,hdfs,"The minimum number of replications that are needed to not to fail the write pipeline if new datanodes can not be found to replace failed datanodes (could be due to network failure) in the write pipeline. If the number of the remaining datanodes in the write pipeline is greater than or equal to this property value, continue writing to the remaining nodes. Otherwise throw exception. If this is set to 0, an exception will be thrown, when a replacement can not be found. See also dfs.client.block.write.replace-datanode-on-failure.policy",reliability,
dfs.blockreport.intervalMsec,hdfs,Determines block reporting interval in milliseconds.,reliability,
dfs.blockreport.initialDelay,hdfs,Delay for first block report in seconds.,reliability,
dfs.blockreport.split.threshold,hdfs,If the number of blocks on the DataNode is below this threshold then it will send block reports for all Storage Directories in a single message. If the number of blocks exceeds this threshold then the DataNode will send block reports for each Storage Directory in separate messages. Set to zero to always split.,debuggability,
dfs.namenode.max.full.block.report.leases,hdfs,The maximum number of leases for full block reports that the NameNode will issue at any given time. This prevents the NameNode from being flooded with full block reports that use up all the RPC handler threads. This number should never be more than the number of RPC handler threads or less than 1.,reliability,
dfs.namenode.full.block.report.lease.length.ms,hdfs,The number of milliseconds that the NameNode will wait before invalidating a full block report lease. This prevents a crashed DataNode from permanently using up a full block report lease.,reliability,
dfs.datanode.directoryscan.interval,hdfs,Interval in seconds for Datanode to scan data directories and reconcile the difference between blocks in memory and on the disk.,reliability,
dfs.datanode.directoryscan.threads,hdfs,How many threads should the threadpool used to compile reports for volumes in parallel have.,performance,
dfs.datanode.directoryscan.throttle.limit.ms.per.sec,hdfs,"The report compilation threads are limited to only running for a given number of milliseconds per second, as configured by the property. The limit is taken per thread, not in aggregate, e.g. setting a limit of 100ms for 4 compiler threads will result in each thread being limited to 100ms, not 25ms. Note that the throttle does not interrupt the report compiler threads, so the actual running time of the threads per second will typically be somewhat higher than the throttle limit, usually by no more than 20%. Setting this limit to 1000 disables compiler thread throttling. Only values between 1 and 1000 are valid. Setting an invalid value will result in the throttle being disabled and an error message being logged. 1000 is the default setting.",performance,
dfs.heartbeat.interval,hdfs,Determines datanode heartbeat interval in seconds.,reliability,
dfs.datanode.lifeline.interval.seconds,hdfs,"Sets the interval in seconds between sending DataNode Lifeline Protocol messages from the DataNode to the NameNode. The value must be greater than the value of dfs.heartbeat.interval. If this property is not defined, then the default behavior is to calculate the interval as 3x the value of dfs.heartbeat.interval. Note that normal heartbeat processing may cause the DataNode to postpone sending lifeline messages if they are not required. Under normal operations with speedy heartbeat processing, it is possible that no lifeline messages will need to be sent at all. This property has no effect if dfs.namenode.lifeline.rpc-address is not defined.",reliability,
dfs.namenode.handler.count,hdfs,The number of Namenode RPC server threads that listen to requests from clients. If dfs.namenode.servicerpc-address is not configured then Namenode RPC server threads listen to requests from all nodes.,performance,
dfs.namenode.service.handler.count,hdfs,The number of Namenode RPC server threads that listen to requests from DataNodes and from all other non-client nodes. dfs.namenode.service.handler.count will be valid only if dfs.namenode.servicerpc-address is configured.,performance,
dfs.namenode.lifeline.handler.ratio,hdfs,"A ratio applied to the value of dfs.namenode.handler.count, which then provides the number of RPC server threads the NameNode runs for handling the lifeline RPC server. For example, if dfs.namenode.handler.count is 100, and dfs.namenode.lifeline.handler.factor is 0.10, then the NameNode starts 100 * 0.10 = 10 threads for handling the lifeline RPC server. It is common to tune the value of dfs.namenode.handler.count as a function of the number of DataNodes in a cluster. Using this property allows for the lifeline RPC server handler threads to be tuned automatically without needing to touch a separate property. Lifeline message processing is lightweight, so it is expected to require many fewer threads than the main NameNode RPC server. This property is not used if dfs.namenode.lifeline.handler.count is defined, which sets an absolute thread count. This property has no effect if dfs.namenode.lifeline.rpc-address is not defined.",performance,
dfs.namenode.lifeline.handler.count,hdfs,"Sets an absolute number of RPC server threads the NameNode runs for handling the DataNode Lifeline Protocol and HA health check requests from ZKFC. If this property is defined, then it overrides the behavior of dfs.namenode.lifeline.handler.ratio. By default, it is not defined. This property has no effect if dfs.namenode.lifeline.rpc-address is not defined.",performance,
dfs.namenode.safemode.threshold-pct,hdfs,Specifies the percentage of blocks that should satisfy the minimal replication requirement defined by dfs.namenode.replication.min. Values less than or equal to 0 mean not to wait for any particular percentage of blocks before exiting safemode. Values greater than 1 will make safe mode permanent.,security,
dfs.namenode.safemode.min.datanodes,hdfs,Specifies the number of datanodes that must be considered alive before the name node exits safemode. Values less than or equal to 0 mean not to take the number of live datanodes into account when deciding whether to remain in safe mode during startup. Values greater than the number of datanodes in the cluster will make safe mode permanent.,security,
dfs.namenode.safemode.extension,hdfs,"Determines extension of safe mode in milliseconds after the threshold level is reached. Support multiple time unit suffix (case insensitive), as described in dfs.heartbeat.interval.",security,
dfs.namenode.resource.check.interval,hdfs,"The interval in milliseconds at which the NameNode resource checker runs. The checker calculates the number of the NameNode storage volumes whose available spaces are more than dfs.namenode.resource.du.reserved, and enters safemode if the number becomes lower than the minimum value specified by dfs.namenode.resource.checked.volumes.minimum.",reliability,
dfs.namenode.resource.du.reserved,hdfs,The amount of space to reserve/require for a NameNode storage directory in bytes. The default is 100MB.,manageability,
dfs.namenode.resource.checked.volumes,hdfs,A list of local directories for the NameNode resource checker to check in addition to the local edits directories.,environment,
dfs.namenode.resource.checked.volumes.minimum,hdfs,The minimum number of redundant NameNode storage volumes required.,manageability,
dfs.datanode.balance.bandwidthPerSec,hdfs,"Specifies the maximum amount of bandwidth that each datanode can utilize for the balancing purpose in term of the number of bytes per second. You can use the following suffix (case insensitive): k(kilo), m(mega), g(giga), t(tera), p(peta), e(exa)to specify the size (such as 128k, 512m, 1g, etc.). Or provide complete size in bytes (such as 134217728 for 128 MB).",performance,
dfs.hosts,hdfs,"Names a file that contains a list of hosts that are permitted to connect to the namenode. The full pathname of the file must be specified. If the value is empty, all hosts are permitted.",security,
dfs.hosts.exclude,hdfs,"Names a file that contains a list of hosts that are not permitted to connect to the namenode. The full pathname of the file must be specified. If the value is empty, no hosts are excluded.",security,
