name,software,description,label,
dfs.namenode.max.objects,hdfs,"The maximum number of files, directories and blocks dfs supports. A value of zero indicates no limit to the number of objects that dfs supports.",manageability,
dfs.namenode.datanode.registration.ip-hostname-check,hdfs,"If true (the default), then the namenode requires that a connecting datanode's address must be resolved to a hostname. If necessary, a reverse DNS lookup is performed. All attempts to register a datanode from an unresolvable address are rejected. It is recommended that this setting be left on to prevent accidental registration of datanodes listed by hostname in the excludes file during a DNS outage. Only set this to false in environments where there is no infrastructure to support reverse DNS lookup.",security,
dfs.namenode.decommission.interval,hdfs,"Namenode periodicity in seconds to check if decommission or maintenance is complete. Support multiple time unit suffix(case insensitive), as described in dfs.heartbeat.interval.",reliability,
dfs.namenode.decommission.blocks.per.interval,hdfs,"The approximate number of blocks to process per decommission or maintenance interval, as defined in dfs.namenode.decommission.interval.",performance,
dfs.namenode.decommission.max.concurrent.tracked.nodes,hdfs,The maximum number of decommission-in-progress or entering-maintenance datanodes nodes that will be tracked at one time by the namenode. Tracking these datanode consumes additional NN memory proportional to the number of blocks on the datnode. Having a conservative limit reduces the potential impact of decommissioning or maintenance of a large number of nodes at once. A value of 0 means no limit will be enforced.,debuggability,
dfs.namenode.replication.interval,hdfs,The periodicity in seconds with which the namenode computes replication work for datanodes.,reliability,
dfs.namenode.accesstime.precision,hdfs,The access time for HDFS file is precise upto this value. The default value is 1 hour. Setting a value of 0 disables access times for HDFS.,manageability,
dfs.datanode.plugins,hdfs,Comma-separated list of datanode plug-ins to be activated.,manageability,
dfs.namenode.plugins,hdfs,Comma-separated list of namenode plug-ins to be activated.,manageability,
dfs.namenode.block-placement-policy.default.prefer-local-node,hdfs,"Controls how the default block placement policy places the first replica of a block. When true, it will prefer the node where the client is running. When false, it will prefer a node in the same rack as the client. Setting to false avoids situations where entire copies of large files end up on a single node, thus creating hotspots.",performance,
dfs.stream-buffer-size,hdfs,"The size of buffer to stream files. The size of this buffer should probably be a multiple of hardware page size (4096 on Intel x86), and it determines how much data is buffered during read and write operations.",performance,
dfs.bytes-per-checksum,hdfs,The number of bytes per checksum. Must not be larger than dfs.stream-buffer-size,performance,
dfs.client-write-packet-size,hdfs,Packet size for clients to write,manageability,
dfs.client.write.exclude.nodes.cache.expiry.interval.millis,hdfs,"The maximum period to keep a DN in the excluded nodes list at a client. After this period, in milliseconds, the previously excluded node(s) will be removed automatically from the cache and will be considered good for block allocations again. Useful to lower or raise in situations where you keep a file open for very long periods (such as a Write-Ahead-Log (WAL) file) to make the writer tolerant to cluster maintenance restarts. Defaults to 10 minutes.",reliability,
dfs.namenode.checkpoint.dir,hdfs,Determines where on the local filesystem the DFS secondary name node should store the temporary images to merge. If this is a comma-delimited list of directories then the image is replicated in all of the directories for redundancy.,environment,
dfs.namenode.checkpoint.edits.dir,hdfs,Determines where on the local filesystem the DFS secondary name node should store the temporary edits to merge. If this is a comma-delimited list of directories then the edits is replicated in all of the directories for redundancy. Default value is same as dfs.namenode.checkpoint.dir,environment,
dfs.namenode.checkpoint.period,hdfs,The number of seconds between two periodic checkpoints.,reliability,
dfs.namenode.checkpoint.txns,hdfs,"The Secondary NameNode or CheckpointNode will create a checkpoint of the namespace every 'dfs.namenode.checkpoint.txns' transactions, regardless of whether 'dfs.namenode.checkpoint.period' has expired.",reliability,
dfs.namenode.checkpoint.check.period,hdfs,The SecondaryNameNode and CheckpointNode will poll the NameNode every 'dfs.namenode.checkpoint.check.period' seconds to query the number of uncheckpointed transactions.,reliability,
dfs.namenode.checkpoint.max-retries,hdfs,"The SecondaryNameNode retries failed checkpointing. If the failure occurs while loading fsimage or replaying edits, the number of retries is limited by this variable.",reliability,
dfs.namenode.num.checkpoints.retained,hdfs,The number of image checkpoint files (fsimage_*) that will be retained by the NameNode and Secondary NameNode in their storage directories. All edit logs (stored on edits_* files) necessary to recover an up-to-date namespace from the oldest retained checkpoint will also be retained.,reliability,
dfs.namenode.num.extra.edits.retained,hdfs,"The number of extra transactions which should be retained beyond what is minimally necessary for a NN restart. It does not translate directly to file's age, or the number of files kept, but to the number of transactions (here ""edits"" means transactions). One edit file may contain several transactions (edits). During checkpoint, NameNode will identify the total number of edits to retain as extra by checking the latest checkpoint transaction value, subtracted by the value of this property. Then, it scans edits files to identify the older ones that don't include the computed range of retained transactions that are to be kept around, and purges them subsequently. The retainment can be useful for audit purposes or for an HA setup where a remote Standby Node may have been offline for some time and need to have a longer backlog of retained edits in order to start again. Typically each edit is on the order of a few hundred bytes, so the default of 1 million edits should be on the order of hundreds of MBs or low GBs. NOTE: Fewer extra edits may be retained than value specified for this setting if doing so would mean that more segments would be retained than the number configured by dfs.namenode.max.extra.edits.segments.retained.",reliability,
dfs.namenode.max.extra.edits.segments.retained,hdfs,"The maximum number of extra edit log segments which should be retained beyond what is minimally necessary for a NN restart. When used in conjunction with dfs.namenode.num.extra.edits.retained, this configuration property serves to cap the number of extra edits files to a reasonable value.",reliability,
dfs.namenode.delegation.key.update-interval,hdfs,The update interval for master key for delegation tokens in the namenode in milliseconds.,security,
dfs.namenode.delegation.token.max-lifetime,hdfs,The maximum lifetime in milliseconds for which a delegation token is valid.,security,
dfs.namenode.delegation.token.renew-interval,hdfs,The renewal interval for delegation token in milliseconds.,security,
dfs.datanode.failed.volumes.tolerated,hdfs,The number of volumes that are allowed to fail before a datanode stops offering service. By default any volume failure will cause a datanode to shutdown.,reliability,
dfs.image.compress,hdfs,Should the dfs image be compressed?,others,
dfs.image.compression.codec,hdfs,"If the dfs image is compressed, how should they be compressed? This has to be a codec defined in io.compression.codecs.",performance,
dfs.image.transfer.timeout,hdfs,"Socket timeout for the HttpURLConnection instance used in the image transfer. This is measured in milliseconds. This timeout prevents client hangs if the connection is idle for this configured timeout, during image transfer.",reliability,
dfs.image.transfer.bandwidthPerSec,hdfs,"Maximum bandwidth used for regular image transfers (instead of bootstrapping the standby namenode), in bytes per second. This can help keep normal namenode operations responsive during checkpointing. A default value of 0 indicates that throttling is disabled. The maximum bandwidth used for bootstrapping standby namenode is configured with dfs.image.transfer-bootstrap-standby.bandwidthPerSec.",performance,
dfs.image.transfer-bootstrap-standby.bandwidthPerSec,hdfs,"Maximum bandwidth used for transferring image to bootstrap standby namenode, in bytes per second. A default value of 0 indicates that throttling is disabled. This default value should be used in most cases, to ensure timely HA operations. The maximum bandwidth used for regular image transfers is configured with dfs.image.transfer.bandwidthPerSec.",performance,
dfs.image.transfer.chunksize,hdfs,Chunksize in bytes to upload the checkpoint. Chunked streaming is used to avoid internal buffering of contents of image file of huge size.,performance,
dfs.namenode.support.allow.format,hdfs,"Does HDFS namenode allow itself to be formatted? You may consider setting this to false for any production cluster, to avoid any possibility of formatting a running DFS.",manageability,
dfs.datanode.max.transfer.threads,hdfs,Specifies the maximum number of threads to use for transferring data in and out of the DN.,performance,
dfs.datanode.scan.period.hours,hdfs,"If this is positive, the DataNode will not scan any individual block more than once in the specified scan period. If this is negative, the block scanner is disabled. If this is set to zero, then the default value of 504 hours or 3 weeks is used. Prior versions of HDFS incorrectly documented that setting this key to zero will disable the block scanner.",reliability,
dfs.block.scanner.volume.bytes.per.second,hdfs,"If this is 0, the DataNode's block scanner will be disabled. If this is positive, this is the number of bytes per second that the DataNode's block scanner will try to scan from each volume.",performance,
dfs.datanode.readahead.bytes,hdfs,"While reading block files, if the Hadoop native libraries are available, the datanode can use the posix_fadvise system call to explicitly page data into the operating system buffer cache ahead of the current reader's position. This can improve performance especially when disks are highly contended. This configuration specifies the number of bytes ahead of the current read position which the datanode will attempt to read ahead. This feature may be disabled by configuring this property to 0. If the native libraries are not available, this configuration has no effect.",performance,
dfs.datanode.drop.cache.behind.reads,hdfs,"In some workloads, the data read from HDFS is known to be significantly large enough that it is unlikely to be useful to cache it in the operating system buffer cache. In this case, the DataNode may be configured to automatically purge all data from the buffer cache after it is delivered to the client. This behavior is automatically disabled for workloads which read only short sections of a block (e.g HBase random-IO workloads). This may improve performance for some workloads by freeing buffer cache space usage for more cacheable data. If the Hadoop native libraries are not available, this configuration has no effect.",performance,
dfs.datanode.drop.cache.behind.writes,hdfs,"In some workloads, the data written to HDFS is known to be significantly large enough that it is unlikely to be useful to cache it in the operating system buffer cache. In this case, the DataNode may be configured to automatically purge all data from the buffer cache after it is written to disk. This may improve performance for some workloads by freeing buffer cache space usage for more cacheable data. If the Hadoop native libraries are not available, this configuration has no effect.",performance,
dfs.datanode.sync.behind.writes,hdfs,"If this configuration is enabled, the datanode will instruct the operating system to enqueue all written data to the disk immediately after it is written. This differs from the usual OS policy which may wait for up to 30 seconds before triggering writeback. This may improve performance for some workloads by smoothing the IO profile for data written to disk. If the Hadoop native libraries are not available, this configuration has no effect.",performance,
dfs.client.failover.max.attempts,hdfs,Expert only. The number of client failover attempts that should be made before the failover is considered failed.,reliability,
dfs.client.failover.sleep.base.millis,hdfs,"Expert only. The time to wait, in milliseconds, between failover attempts increases exponentially as a function of the number of attempts made so far, with a random factor of +/- 50%. This option specifies the base value used in the failover calculation. The first failover will retry immediately. The 2nd failover attempt will delay at least dfs.client.failover.sleep.base.millis milliseconds. And so on.",reliability,
dfs.client.failover.sleep.max.millis,hdfs,"Expert only. The time to wait, in milliseconds, between failover attempts increases exponentially as a function of the number of attempts made so far, with a random factor of +/- 50%. This option specifies the maximum value to wait between failovers. Specifically, the time between two failover attempts will not exceed +/- 50% of dfs.client.failover.sleep.max.millis milliseconds.",reliability,
dfs.client.failover.connection.retries,hdfs,Expert only. Indicates the number of retries a failover IPC client will make to establish a server connection.,reliability,
dfs.client.failover.connection.retries.on.timeouts,hdfs,Expert only. The number of retry attempts a failover IPC client will make on socket timeout when establishing a server connection.,reliability,
dfs.client.datanode-restart.timeout,hdfs,"Expert only. The time to wait, in seconds, from reception of an datanode shutdown notification for quick restart, until declaring the datanode dead and invoking the normal recovery mechanisms. The notification is sent by a datanode when it is being shutdown using the shutdownDatanode admin command with the upgrade option.",reliability,
dfs.nameservices,hdfs,Comma-separated list of nameservices.,environment,
dfs.nameservice.id,hdfs,The ID of this nameservice. If the nameservice ID is not configured or more than one nameservice is configured for dfs.nameservices it is determined automatically by matching the local node's address with the configured address.,environment,
dfs.internal.nameservices,hdfs,Comma-separated list of nameservices that belong to this cluster. Datanode will report to all the nameservices in this list. By default this is set to the value of dfs.nameservices.,manageability,
dfs.ha.namenodes.EXAMPLENAMESERVICE,hdfs,"The prefix for a given nameservice, contains a comma-separated list of namenodes for a given nameservice (eg EXAMPLENAMESERVICE). Unique identifiers for each NameNode in the nameservice, delimited by commas. This will be used by DataNodes to determine all the NameNodes in the cluster. For example, if you used mycluster as the nameservice ID previously, and you wanted to use nn1 and nn2 as the individual IDs of the NameNodes, you would configure a property dfs.ha.namenodes.mycluster, and its value ""nn1,nn2"".",manageability,
dfs.ha.namenode.id,hdfs,The ID of this namenode. If the namenode ID is not configured it is determined automatically by matching the local node's address with the configured address.,environment,
dfs.ha.log-roll.period,hdfs,"How often, in seconds, the StandbyNode should ask the active to roll edit logs. Since the StandbyNode only reads from finalized log segments, the StandbyNode will only be as up-to-date as how often the logs are rolled. Note that failover triggers a log roll so the StandbyNode will be up to date before it becomes active.",debuggability,
dfs.ha.tail-edits.period,hdfs,"How often, in seconds, the StandbyNode should check for new finalized log segments in the shared edits log.",debuggability,
dfs.ha.tail-edits.rolledits.timeout,hdfs,The timeout in seconds of calling rollEdits RPC on Active NN.,reliability,
dfs.ha.automatic-failover.enabled,hdfs,Whether automatic failover is enabled. See the HDFS High Availability documentation for details on automatic HA configuration.,reliability,
dfs.client.use.datanode.hostname,hdfs,Whether clients should use datanode hostnames when connecting to datanodes.,manageability,
dfs.datanode.use.datanode.hostname,hdfs,Whether datanodes should use datanode hostnames when connecting to other datanodes for data transfer.,manageability,
dfs.client.local.interfaces,hdfs,"A comma separated list of network interface names to use for data transfer between the client and datanodes. When creating a connection to read from or write to a datanode, the client chooses one of the specified interfaces at random and binds its socket to the IP of that interface. Individual names may be specified as either an interface name (eg ""eth0""), a subinterface name (eg ""eth0:0""), or an IP address (which may be specified using CIDR notation to match a range of IPs).",environment,
dfs.datanode.shared.file.descriptor.paths,hdfs,"A comma-separated list of paths to use when creating file descriptors that will be shared between the DataNode and the DFSClient. Typically we use /dev/shm, so that the file descriptors will not be written to disk. Systems that don't have /dev/shm will fall back to /tmp by default.",environment,
dfs.short.circuit.shared.memory.watcher.interrupt.check.ms,hdfs,The length of time in milliseconds that the short-circuit shared memory watcher will go between checking for java interruptions sent from other threads. This is provided mainly for unit tests.,reliability,
dfs.namenode.kerberos.principal,hdfs,The NameNode service principal. This is typically set to nn/_HOST@REALM.TLD. Each NameNode will substitute _HOST with its own fully qualified hostname at startup. The _HOST placeholder allows using the same configuration setting on both NameNodes in an HA setup.,security,
dfs.namenode.keytab.file,hdfs,The keytab file used by each NameNode daemon to login as its service principal. The principal name is configured with dfs.namenode.kerberos.principal.,environment,
dfs.datanode.kerberos.principal,hdfs,The DataNode service principal. This is typically set to dn/_HOST@REALM.TLD. Each DataNode will substitute _HOST with its own fully qualified hostname at startup. The _HOST placeholder allows using the same configuration setting on all DataNodes.,security,
dfs.datanode.keytab.file,hdfs,The keytab file used by each DataNode daemon to login as its service principal. The principal name is configured with dfs.datanode.kerberos.principal.,environment,
dfs.journalnode.kerberos.principal,hdfs,The JournalNode service principal. This is typically set to jn/_HOST@REALM.TLD. Each JournalNode will substitute _HOST with its own fully qualified hostname at startup. The _HOST placeholder allows using the same configuration setting on all JournalNodes.,security,
dfs.journalnode.keytab.file,hdfs,The keytab file used by each JournalNode daemon to login as its service principal. The principal name is configured with dfs.journalnode.kerberos.principal.,environment,
dfs.namenode.kerberos.internal.spnego.principal,hdfs,"The server principal used by the NameNode for web UI SPNEGO authentication when Kerberos security is enabled. This is typically set to HTTP/_HOST@REALM.TLD The SPNEGO server principal begins with the prefix HTTP/ by convention. If the value is '*', the web server will attempt to login with every principal specified in the keytab file dfs.web.authentication.kerberos.keytab.",security,
dfs.journalnode.kerberos.internal.spnego.principal,hdfs,"The server principal used by the JournalNode HTTP Server for SPNEGO authentication when Kerberos security is enabled. This is typically set to HTTP/_HOST@REALM.TLD. The SPNEGO server principal begins with the prefix HTTP/ by convention. If the value is '*', the web server will attempt to login with every principal specified in the keytab file dfs.web.authentication.kerberos.keytab. For most deployments this can be set to ${dfs.web.authentication.kerberos.principal} i.e use the value of dfs.web.authentication.kerberos.principal.",security,
dfs.secondary.namenode.kerberos.internal.spnego.principal,hdfs,"The server principal used by the Secondary NameNode for web UI SPNEGO authentication when Kerberos security is enabled. Like all other Secondary NameNode settings, it is ignored in an HA setup. If the value is '*', the web server will attempt to login with every principal specified in the keytab file dfs.web.authentication.kerberos.keytab.",security,
dfs.web.authentication.kerberos.principal,hdfs,The server principal used by the NameNode for WebHDFS SPNEGO authentication. Required when WebHDFS and security are enabled. In most secure clusters this setting is also used to specify the values for dfs.namenode.kerberos.internal.spnego.principal and dfs.journalnode.kerberos.internal.spnego.principal.,security,
dfs.web.authentication.kerberos.keytab,hdfs,The keytab file for the principal corresponding to dfs.web.authentication.kerberos.principal.,environment,
dfs.namenode.kerberos.principal.pattern,hdfs,A client-side RegEx that can be configured to control allowed realms to authenticate with (useful in cross-realm env.),security,
dfs.namenode.avoid.read.stale.datanode,hdfs,"Indicate whether or not to avoid reading from ""stale"" datanodes whose heartbeat messages have not been received by the namenode for more than a specified time interval. Stale datanodes will be moved to the end of the node list returned for reading. See dfs.namenode.avoid.write.stale.datanode for a similar setting for writes.",reliability,
dfs.namenode.avoid.write.stale.datanode,hdfs,"Indicate whether or not to avoid writing to ""stale"" datanodes whose heartbeat messages have not been received by the namenode for more than a specified time interval. Writes will avoid using stale datanodes unless more than a configured ratio (dfs.namenode.write.stale.datanode.ratio) of datanodes are marked as stale. See dfs.namenode.avoid.read.stale.datanode for a similar setting for reads.",reliability,
dfs.namenode.stale.datanode.interval,hdfs,"Default time interval in milliseconds for marking a datanode as ""stale"", i.e., if the namenode has not received heartbeat msg from a datanode for more than this time interval, the datanode will be marked and treated as ""stale"" by default. The stale interval cannot be too small since otherwise this may cause too frequent change of stale states. We thus set a minimum stale interval value (the default value is 3 times of heartbeat interval) and guarantee that the stale interval cannot be less than the minimum value. A stale data node is avoided during lease/block recovery. It can be conditionally avoided for reads (see dfs.namenode.avoid.read.stale.datanode) and for writes (see dfs.namenode.avoid.write.stale.datanode).",reliability,
dfs.namenode.write.stale.datanode.ratio,hdfs,"When the ratio of number stale datanodes to total datanodes marked is greater than this ratio, stop avoiding writing to stale nodes so as to prevent causing hotspots.",reliability,
dfs.namenode.invalidate.work.pct.per.iteration,hdfs,"*Note*: Advanced property. Change with caution. This determines the percentage amount of block invalidations (deletes) to do over a single DN heartbeat deletion command. The final deletion count is determined by applying this percentage to the number of live nodes in the system. The resultant number is the number of blocks from the deletion list chosen for proper invalidation over a single heartbeat of a single DN. Value should be a positive, non-zero percentage in float notation (X.Yf), with 1.0f meaning 100%.",reliability,
dfs.namenode.replication.work.multiplier.per.iteration,hdfs,"*Note*: Advanced property. Change with caution. This determines the total amount of block transfers to begin in parallel at a DN, for replication, when such a command list is being sent over a DN heartbeat by the NN. The actual number is obtained by multiplying this multiplier with the total number of live nodes in the cluster. The result number is the number of blocks to begin transfers immediately for, per DN heartbeat. This number can be any positive, non-zero integer.",reliability,
nfs.server.port,hdfs,Specify the port number used by Hadoop NFS.,environment,
nfs.mountd.port,hdfs,Specify the port number used by Hadoop mount daemon.,environment,
nfs.dump.dir,hdfs,"This directory is used to temporarily save out-of-order writes before writing to HDFS. For each file, the out-of-order writes are dumped after they are accumulated to exceed certain threshold (e.g., 1MB) in memory. One needs to make sure the directory has enough space.",environment,
nfs.rtmax,hdfs,"This is the maximum size in bytes of a READ request supported by the NFS gateway. If you change this, make sure you also update the nfs mount's rsize(add rsize= # of bytes to the mount directive).",performance,
nfs.wtmax,hdfs,"This is the maximum size in bytes of a WRITE request supported by the NFS gateway. If you change this, make sure you also update the nfs mount's wsize(add wsize= # of bytes to the mount directive).",performance,
nfs.keytab.file,hdfs,*Note*: Advanced property. Change with caution. This is the path to the keytab file for the hdfs-nfs gateway. This is required when the cluster is kerberized.,security,
