name,software,description,label,
nfs.kerberos.principal,hdfs,*Note*: Advanced property. Change with caution. This is the name of the kerberos principal. This is required when the cluster is kerberized.It must be of this format: nfs-gateway-user/nfs-gateway-host@kerberos-realm,security,
nfs.allow.insecure.ports,hdfs,"When set to false, client connections originating from unprivileged ports (those above 1023) will be rejected. This is to ensure that clients connecting to this NFS Gateway must have had root privilege on the machine where they're connecting from.",security,
dfs.webhdfs.enabled,hdfs,Enable WebHDFS (REST API) in Namenodes and Datanodes.,environment,
hadoop.fuse.connection.timeout,hdfs,The minimum number of seconds that we'll cache libhdfs connection objects in fuse_dfs. Lower values will result in lower memory consumption; higher values may speed up access by avoiding the overhead of creating new connection objects.,reliability,
hadoop.fuse.timer.period,hdfs,The number of seconds between cache expiry checks in fuse_dfs. Lower values will result in fuse_dfs noticing changes to Kerberos ticket caches more quickly.,reliability,
dfs.namenode.metrics.logger.period.seconds,hdfs,This setting controls how frequently the NameNode logs its metrics. The logging configuration must also define one or more appenders for NameNodeMetricsLog for the metrics to be logged. NameNode metrics logging is disabled if this value is set to zero or less than zero.,debuggability,
dfs.datanode.metrics.logger.period.seconds,hdfs,This setting controls how frequently the DataNode logs its metrics. The logging configuration must also define one or more appenders for DataNodeMetricsLog for the metrics to be logged. DataNode metrics logging is disabled if this value is set to zero or less than zero.,debuggability,
dfs.client.write.max-packets-in-flight,hdfs,The maximum number of DFSPackets allowed in flight.,reliability,
dfs.datanode.peer.stats.enabled,hdfs,A switch to turn on/off tracking DataNode peer statistics.,manageability,
dfs.datanode.outliers.report.interval,hdfs,This setting controls how frequently DataNodes will report their peer latencies to the NameNode via heartbeats. This setting supports multiple time unit suffixes as described in dfs.heartbeat.interval. If no suffix is specified then milliseconds is assumed. It is ignored if dfs.datanode.peer.stats.enabled is false.,others,
dfs.datanode.fileio.profiling.sampling.percentage,hdfs,This setting controls the percentage of file I/O events which will be profiled for DataNode disk statistics. The default value of 0 disables disk statistics. Set to an integer value between 1 and 100 to enable disk statistics.,performance,
hadoop.user.group.metrics.percentiles.intervals,hdfs,"A comma-separated list of the granularity in seconds for the metrics which describe the 50/75/90/95/99th percentile latency for group resolution in milliseconds. By default, percentile latency metrics are disabled.",manageability,
dfs.encrypt.data.transfer,hdfs,"Whether or not actual block data that is read/written from/to HDFS should be encrypted on the wire. This only needs to be set on the NN and DNs, clients will deduce this automatically. It is possible to override this setting per connection by specifying custom logic via dfs.trustedchannel.resolver.class.",security,
dfs.encrypt.data.transfer.algorithm,hdfs,"This value may be set to either ""3des"" or ""rc4"". If nothing is set, then the configured JCE default on the system is used (usually 3DES.) It is widely believed that 3DES is more cryptographically secure, but RC4 is substantially faster. Note that if AES is supported by both the client and server then this encryption algorithm will only be used to initially transfer keys for AES. (See dfs.encrypt.data.transfer.cipher.suites.)",security,
dfs.encrypt.data.transfer.cipher.suites,hdfs,"This value may be either undefined or AES/CTR/NoPadding. If defined, then dfs.encrypt.data.transfer uses the specified cipher suite for data encryption. If not defined, then only the algorithm specified in dfs.encrypt.data.transfer.algorithm is used. By default, the property is not defined.",security,
dfs.encrypt.data.transfer.cipher.key.bitlength,hdfs,"The key bitlength negotiated by dfsclient and datanode for encryption. This value may be set to either 128, 192 or 256.",security,
dfs.trustedchannel.resolver.class,hdfs,"TrustedChannelResolver is used to determine whether a channel is trusted for plain data transfer. The TrustedChannelResolver is invoked on both client and server side. If the resolver indicates that the channel is trusted, then the data transfer will not be encrypted even if dfs.encrypt.data.transfer is set to true. The default implementation returns false indicating that the channel is not trusted.",security,
dfs.data.transfer.protection,hdfs,"A comma-separated list of SASL protection values used for secured connections to the DataNode when reading or writing block data. Possible values are authentication, integrity and privacy. authentication means authentication only and no integrity or privacy; integrity implies authentication and integrity are enabled; and privacy implies all of authentication, integrity and privacy are enabled. If dfs.encrypt.data.transfer is set to true, then it supersedes the setting for dfs.data.transfer.protection and enforces that all connections must use a specialized encrypted SASL handshake. This property is ignored for connections to a DataNode listening on a privileged port. In this case, it is assumed that the use of a privileged port establishes sufficient trust.",security,
dfs.data.transfer.saslproperties.resolver.class,hdfs,"SaslPropertiesResolver used to resolve the QOP used for a connection to the DataNode when reading or writing block data. If not specified, the value of hadoop.security.saslproperties.resolver.class is used as the default value.",security,
dfs.datanode.hdfs-blocks-metadata.enabled,hdfs,Boolean which enables backend datanode-side support for the experimental DistributedFileSystem#getFileVBlockStorageLocations API.,performance,
dfs.client.file-block-storage-locations.num-threads,hdfs,Number of threads used for making parallel RPCs in DistributedFileSystem#getFileBlockStorageLocations().,performance,
dfs.client.file-block-storage-locations.timeout.millis,hdfs,Timeout (in milliseconds) for the parallel RPCs made in DistributedFileSystem#getFileBlockStorageLocations().,reliability,
dfs.journalnode.rpc-address,hdfs,The JournalNode RPC server address and port.,environment,
dfs.journalnode.rpc-bind-host,hdfs,"The actual address the RPC server will bind to. If this optional address is set, it overrides only the hostname portion of dfs.journalnode.rpc-address. This is useful for making the JournalNode listen on all interfaces by setting it to 0.0.0.0.",environment,
dfs.journalnode.http-address,hdfs,The address and port the JournalNode HTTP server listens on. If the port is 0 then the server will start on a free port.,environment,
dfs.journalnode.http-bind-host,hdfs,"The actual address the HTTP server will bind to. If this optional address is set, it overrides only the hostname portion of dfs.journalnode.http-address. This is useful for making the JournalNode HTTP server listen on allinterfaces by setting it to 0.0.0.0.",environment,
dfs.journalnode.https-address,hdfs,The address and port the JournalNode HTTPS server listens on. If the port is 0 then the server will start on a free port.,environment,
dfs.journalnode.https-bind-host,hdfs,"The actual address the HTTP server will bind to. If this optional address is set, it overrides only the hostname portion of dfs.journalnode.https-address. This is useful for making the JournalNode HTTP server listen on all interfaces by setting it to 0.0.0.0.",environment,
dfs.namenode.audit.loggers,hdfs,"List of classes implementing audit loggers that will receive audit events. These should be implementations of org.apache.hadoop.hdfs.server.namenode.AuditLogger. The special value ""default"" can be used to reference the default audit logger, which uses the configured log system. Installing custom audit loggers may affect the performance and stability of the NameNode. Refer to the custom logger's documentation for more details.",debuggability,
dfs.datanode.available-space-volume-choosing-policy.balanced-space-threshold,hdfs,"Only used when the dfs.datanode.fsdataset.volume.choosing.policy is set to org.apache.hadoop.hdfs.server.datanode.fsdataset.AvailableSpaceVolumeChoosingPolicy. This setting controls how much DN volumes are allowed to differ in terms of bytes of free disk space before they are considered imbalanced. If the free space of all the volumes are within this range of each other, the volumes will be considered balanced and block assignments will be done on a pure round robin basis.",performance,
dfs.datanode.available-space-volume-choosing-policy.balanced-space-preference-fraction,hdfs,"Only used when the dfs.datanode.fsdataset.volume.choosing.policy is set to org.apache.hadoop.hdfs.server.datanode.fsdataset.AvailableSpaceVolumeChoosingPolicy. This setting controls what percentage of new block allocations will be sent to volumes with more available disk space than others. This setting should be in the range 0.0 - 1.0, though in practice 0.5 - 1.0, since there should be no reason to prefer that volumes with less available disk space receive more block allocations.",performance,
dfs.namenode.edits.noeditlogchannelflush,hdfs,"Specifies whether to flush edit log file channel. When set, expensive FileChannel#force calls are skipped and synchronous disk writes are enabled instead by opening the edit log file with RandomAccessFile(""rws"") flags. This can significantly improve the performance of edit log writes on the Windows platform. Note that the behavior of the ""rws"" flags is platform and hardware specific and might not provide the same level of guarantees as FileChannel#force. For example, the write will skip the disk-cache on SAS and SCSI devices while it might not on SATA devices. This is an expert level setting, change with caution.",performance,
dfs.client.cache.drop.behind.writes,hdfs,"Just like dfs.datanode.drop.cache.behind.writes, this setting causes the page cache to be dropped behind HDFS writes, potentially freeing up more memory for other uses. Unlike dfs.datanode.drop.cache.behind.writes, this is a client-side setting rather than a setting for the entire datanode. If present, this setting will override the DataNode default. If the native libraries are not available to the DataNode, this configuration has no effect.",performance,
dfs.client.cache.drop.behind.reads,hdfs,"Just like dfs.datanode.drop.cache.behind.reads, this setting causes the page cache to be dropped behind HDFS reads, potentially freeing up more memory for other uses. Unlike dfs.datanode.drop.cache.behind.reads, this is a client-side setting rather than a setting for the entire datanode. If present, this setting will override the DataNode default. If the native libraries are not available to the DataNode, this configuration has no effect.",performance,
dfs.client.cache.readahead,hdfs,"When using remote reads, this setting causes the datanode to read ahead in the block file using posix_fadvise, potentially decreasing I/O wait times. Unlike dfs.datanode.readahead.bytes, this is a client-side setting rather than a setting for the entire datanode. If present, this setting will override the DataNode default. When using local reads, this setting determines how much readahead we do in BlockReaderLocal. If the native libraries are not available to the DataNode, this configuration has no effect.",performance,
dfs.client.server-defaults.validity.period.ms,hdfs,The amount of milliseconds after which cached server defaults are updated. By default this parameter is set to 1 hour.,reliability,
dfs.namenode.enable.retrycache,hdfs,"This enables the retry cache on the namenode. Namenode tracks for non-idempotent requests the corresponding response. If a client retries the request, the response from the retry cache is sent. Such operations are tagged with annotation @AtMostOnce in namenode protocols. It is recommended that this flag be set to true. Setting it to false, will result in clients getting failure responses to retried request. This flag must be enabled in HA setup for transparent fail-overs. The entries in the cache have expiration time configurable using dfs.namenode.retrycache.expirytime.millis.",reliability,
dfs.namenode.retrycache.expirytime.millis,hdfs,The time for which retry cache entries are retained.,reliability,
dfs.namenode.retrycache.heap.percent,hdfs,"This parameter configures the heap size allocated for retry cache (excluding the response cached). This corresponds to approximately 4096 entries for every 64MB of namenode process java heap size. Assuming retry cache entry expiration time (configured using dfs.namenode.retrycache.expirytime.millis) of 10 minutes, this enables retry cache to support 7 operations per second sustained for 10 minutes. As the heap size is increased, the operation rate linearly increases.",performance,
dfs.metrics.percentiles.intervals,hdfs,"Comma-delimited set of integers denoting the desired rollover intervals (in seconds) for percentile latency metrics on the Namenode and Datanode. By default, percentile latency metrics are disabled.",reliability,
dfs.client.mmap.cache.size,hdfs,"When zero-copy reads are used, the DFSClient keeps a cache of recently used memory mapped regions. This parameter controls the maximum number of entries that we will keep in that cache. The larger this number is, the more file descriptors we will potentially use for memory-mapped files. mmaped files also use virtual address space. You may need to increase your ulimit virtual address space limits before increasing the client mmap cache size. Note that you can still do zero-copy reads when this size is set to 0.",performance,
dfs.client.mmap.enabled,hdfs,"If this is set to false, the client won't attempt to perform memory-mapped reads.",performance,
dfs.client.mmap.retry.timeout.ms,hdfs,The minimum amount of time that we will wait before retrying a failed mmap operation.,reliability,
dfs.client.short.circuit.replica.stale.threshold.ms,hdfs,"The maximum amount of time that we will consider a short-circuit replica to be valid, if there is no communication from the DataNode. After this time has elapsed, we will re-fetch the short-circuit replica even if it is in the cache.",reliability,
dfs.namenode.path.based.cache.block.map.allocation.percent,hdfs,The percentage of the Java heap which we will allocate to the cached blocks map. The cached blocks map is a hash map which uses chained hashing. Smaller maps may be accessed more slowly if the number of cached blocks is large; larger maps will consume more memory.,performance,
dfs.datanode.max.locked.memory,hdfs,"The amount of memory in bytes to use for caching of block replicas in memory on the datanode. The datanode's maximum locked memory soft ulimit (RLIMIT_MEMLOCK) must be set to at least this value, else the datanode will abort on startup. By default, this parameter is set to 0, which disables in-memory caching. If the native libraries are not available to the DataNode, this configuration has no effect.",performance,
dfs.namenode.list.cache.directives.num.responses,hdfs,This value controls the number of cache directives that the NameNode will send over the wire in response to a listDirectives RPC.,performance,
dfs.namenode.list.cache.pools.num.responses,hdfs,This value controls the number of cache pools that the NameNode will send over the wire in response to a listPools RPC.,performance,
dfs.namenode.path.based.cache.refresh.interval.ms,hdfs,"The amount of milliseconds between subsequent path cache rescans. Path cache rescans are when we calculate which blocks should be cached, and on what datanodes. By default, this parameter is set to 30 seconds.",reliability,
dfs.namenode.path.based.cache.retry.interval.ms,hdfs,"When the NameNode needs to uncache something that is cached, or cache something that is not cached, it must direct the DataNodes to do so by sending a DNA_CACHE or DNA_UNCACHE command in response to a DataNode heartbeat. This parameter controls how frequently the NameNode will resend these commands.",reliability,
dfs.datanode.fsdatasetcache.max.threads.per.volume,hdfs,The maximum number of threads per volume to use for caching new data on the datanode. These threads consume both I/O and CPU. This can affect normal datanode operations.,performance,
dfs.cachereport.intervalMsec,hdfs,"Determines cache reporting interval in milliseconds. After this amount of time, the DataNode sends a full report of its cache state to the NameNode. The NameNode uses the cache report to update its map of cached blocks to DataNode locations. This configuration has no effect if in-memory caching has been disabled by setting dfs.datanode.max.locked.memory to 0 (which is the default). If the native libraries are not available to the DataNode, this configuration has no effect.",reliability,
dfs.namenode.edit.log.autoroll.multiplier.threshold,hdfs,"Determines when an active namenode will roll its own edit log. The actual threshold (in number of edits) is determined by multiplying this value by dfs.namenode.checkpoint.txns. This prevents extremely large edit files from accumulating on the active namenode, which can cause timeouts during namenode startup and pose an administrative hassle. This behavior is intended as a failsafe for when the standby or secondary namenode fail to roll the edit log by the normal checkpoint threshold.",reliability,
dfs.namenode.edit.log.autoroll.check.interval.ms,hdfs,"How often an active namenode will check if it needs to roll its edit log, in milliseconds.",reliability,
dfs.webhdfs.user.provider.user.pattern,hdfs,"Valid pattern for user and group names for webhdfs, it must be a valid java regex.",security,
dfs.webhdfs.acl.provider.permission.pattern,hdfs,"Valid pattern for user and group names in webhdfs acl operations, it must be a valid java regex.",security,
dfs.webhdfs.socket.connect-timeout,hdfs,"Socket timeout for connecting to WebHDFS servers. This prevents a WebHDFS client from hanging if the server hostname is misconfigured, or the server does not response before the timeout expires. Value is followed by a unit specifier: ns, us, ms, s, m, h, d for nanoseconds, microseconds, milliseconds, seconds, minutes, hours, days respectively. Values should provide units, but milliseconds are assumed.",reliability,
dfs.webhdfs.socket.read-timeout,hdfs,"Socket timeout for reading data from WebHDFS servers. This prevents a WebHDFS client from hanging if the server stops sending data. Value is followed by a unit specifier: ns, us, ms, s, m, h, d for nanoseconds, microseconds, milliseconds, seconds, minutes, hours, days respectively. Values should provide units, but milliseconds are assumed.",reliability,
dfs.client.context,hdfs,"The name of the DFSClient context that we should use. Clients that share a context share a socket cache and short-circuit cache, among other things. You should only change this if you don't want to share with another set of threads.",others,
dfs.client.read.shortcircuit,hdfs,This configuration parameter turns on short-circuit local reads.,performance,
dfs.client.socket.send.buffer.size,hdfs,"Socket send buffer size for a write pipeline in DFSClient side. This may affect TCP connection throughput. If it is set to zero or negative value, no buffer size will be set explicitly, thus enable tcp auto-tuning on some system. The default value is 0.",performance,
dfs.domain.socket.path,hdfs,"Optional. This is a path to a UNIX domain socket that will be used for communication between the DataNode and local HDFS clients. If the string ""_PORT"" is present in this path, it will be replaced by the TCP port of the DataNode.",environment,
dfs.client.read.shortcircuit.skip.checksum,hdfs,"If this configuration parameter is set, short-circuit local reads will skip checksums. This is normally not recommended, but it may be useful for special setups. You might consider using this if you are doing your own checksumming outside of HDFS.",reliability,
dfs.client.read.shortcircuit.streams.cache.size,hdfs,"The DFSClient maintains a cache of recently opened file descriptors. This parameter controls the maximum number of file descriptors in the cache. Setting this higher will use more file descriptors, but potentially provide better performance on workloads involving lots of seeks.",performance,
dfs.client.read.shortcircuit.streams.cache.expiry.ms,hdfs,This controls the minimum amount of time file descriptors need to sit in the client cache context before they can be closed for being inactive for too long.,reliability,
dfs.datanode.shared.file.descriptor.paths,hdfs,Comma separated paths to the directory on which shared memory segments are created. The client and the DataNode exchange information via this shared memory segment. It tries paths in order until creation of shared memory segment succeeds.,environment,
dfs.namenode.audit.log.debug.cmdlist,hdfs,A comma separated list of NameNode commands that are written to the HDFS namenode audit log only if the audit log level is debug.,debuggability,
dfs.client.mmap.cache.timeout.ms,hdfs,"The minimum length of time that we will keep an mmap entry in the cache between uses. If an entry is in the cache longer than this, and nobody uses it, it will be removed by a background thread.",performance,
dfs.block.local-path-access.user,hdfs,Comma separated list of the users allowed to open block files on legacy short-circuit local read.,security,
dfs.client.domain.socket.data.traffic,hdfs,This control whether we will try to pass normal data traffic over UNIX domain socket rather than over TCP socket on node-local data transfer. This is currently experimental and turned off by default.,manageability,
dfs.namenode.reject-unresolved-dn-topology-mapping,hdfs,"If the value is set to true, then namenode will reject datanode registration if the topology mapping for a datanode is not resolved and NULL is returned (script defined by net.topology.script.file.name fails to execute). Otherwise, datanode will be registered and the default rack will be assigned as the topology path. Topology paths are important for data resiliency, since they define fault domains. Thus it may be unwanted behavior to allow datanode registration with the default rack if the resolving topology failed.",security,
dfs.client.slow.io.warning.threshold.ms,hdfs,"The threshold in milliseconds at which we will log a slow io warning in a dfsclient. By default, this parameter is set to 30000 milliseconds (30 seconds).",debuggability,
dfs.datanode.slow.io.warning.threshold.ms,hdfs,"The threshold in milliseconds at which we will log a slow io warning in a datanode. By default, this parameter is set to 300 milliseconds.",debuggability,
dfs.namenode.xattrs.enabled,hdfs,Whether support for extended attributes is enabled on the NameNode.,manageability,
dfs.namenode.fs-limits.max-xattrs-per-inode,hdfs,Maximum number of extended attributes per inode.,others,
dfs.namenode.fs-limits.max-xattr-size,hdfs,"The maximum combined size of the name and value of an extended attribute in bytes. It should be larger than 0, and less than or equal to maximum size hard limit which is 32768.",reliability,
dfs.namenode.lease-recheck-interval-ms,hdfs,During the release of lease a lock is hold that make any operations on the namenode stuck. In order to not block them during a too long duration we stop releasing lease after this max lock limit.,reliability,
dfs.namenode.max-lock-hold-to-release-lease-ms,hdfs,During the release of lease a lock is hold that make any operations on the namenode stuck. In order to not block them during a too long duration we stop releasing lease after this max lock limit.,reliability,
dfs.namenode.write-lock-reporting-threshold-ms,hdfs,"When a write lock is held on the namenode for a long time, this will be logged as the lock is released. This sets how long the lock must be held for logging to occur.",debuggability,
dfs.namenode.read-lock-reporting-threshold-ms,hdfs,"When a read lock is held on the namenode for a long time, this will be logged as the lock is released. This sets how long the lock must be held for logging to occur.",debuggability,
dfs.namenode.lock.detailed-metrics.enabled,hdfs,"If true, the namenode will keep track of how long various operations hold the Namesystem lock for and emit this as metrics. These metrics have names of the form FSN(Read|Write)LockNanosOperationName, where OperationName denotes the name of the operation that initiated the lock hold (this will be OTHER for certain uncategorized operations) and they export the hold time values in nanoseconds.",debuggability,
dfs.namenode.fslock.fair,hdfs,"If this is true, the FS Namesystem lock will be used in Fair mode, which will help to prevent writer threads from being starved, but can provide lower lock throughput. See java.util.concurrent.locks.ReentrantReadWriteLock for more information on fair/non-fair locks.",performance,
dfs.namenode.startup.delay.block.deletion.sec,hdfs,"The delay in seconds at which we will pause the blocks deletion after Namenode startup. By default it's disabled. In the case a directory has large number of directories and files are deleted, suggested delay is one hour to give the administrator enough time to notice large number of pending deletion blocks and take corrective action.",reliability,
dfs.namenode.list.encryption.zones.num.responses,hdfs,"When listing encryption zones, the maximum number of zones that will be returned in a batch. Fetching the list incrementally in batches improves namenode performance.",performance,
